{
  "env_name": "battlestation_batman",
  "reference_image": "/Users/spectrasynq/K1-Lightwave_Digital-Twin/04_SAM3D_Environments/assets/reference/processed/battlestation_batman.jpg",
  "objects": [
    {
      "name": "gaming_chair",
      "mesh_path": "/Users/spectrasynq/K1-Lightwave_Digital-Twin/04_SAM3D_Environments/assets/meshes/battlestation_batman/gaming_chair.obj",
      "mask_path": "/Users/spectrasynq/K1-Lightwave_Digital-Twin/04_SAM3D_Environments/assets/masks/battlestation_batman/gaming_chair.png",
      "location": [
        0.0,
        0.0,
        0.0
      ],
      "rotation_euler": [
        0.0,
        0.0,
        0.0
      ],
      "scale": [
        1.0,
        1.0,
        1.0
      ]
    },
    {
      "name": "desk_surface",
      "mesh_path": "/Users/spectrasynq/K1-Lightwave_Digital-Twin/04_SAM3D_Environments/assets/meshes/battlestation_batman/desk_surface.obj",
      "mask_path": "/Users/spectrasynq/K1-Lightwave_Digital-Twin/04_SAM3D_Environments/assets/masks/battlestation_batman/desk_surface.png",
      "location": [
        0.0,
        0.0,
        0.0
      ],
      "rotation_euler": [
        0.0,
        0.0,
        0.0
      ],
      "scale": [
        1.0,
        1.0,
        1.0
      ]
    },
    {
      "name": "monitor",
      "mesh_path": "/Users/spectrasynq/K1-Lightwave_Digital-Twin/04_SAM3D_Environments/assets/meshes/battlestation_batman/monitor.obj",
      "mask_path": "/Users/spectrasynq/K1-Lightwave_Digital-Twin/04_SAM3D_Environments/assets/masks/battlestation_batman/monitor.png",
      "location": [
        0.0,
        0.0,
        0.0
      ],
      "rotation_euler": [
        0.0,
        0.0,
        0.0
      ],
      "scale": [
        1.0,
        1.0,
        1.0
      ]
    },
    {
      "name": "pc_tower",
      "mesh_path": "/Users/spectrasynq/K1-Lightwave_Digital-Twin/04_SAM3D_Environments/assets/meshes/battlestation_batman/pc_tower.obj",
      "mask_path": "/Users/spectrasynq/K1-Lightwave_Digital-Twin/04_SAM3D_Environments/assets/masks/battlestation_batman/pc_tower.png",
      "location": [
        0.0,
        0.0,
        0.0
      ],
      "rotation_euler": [
        0.0,
        0.0,
        0.0
      ],
      "scale": [
        1.0,
        1.0,
        1.0
      ]
    },
    {
      "name": "keyboard",
      "mesh_path": "/Users/spectrasynq/K1-Lightwave_Digital-Twin/04_SAM3D_Environments/assets/meshes/battlestation_batman/keyboard.obj",
      "mask_path": "/Users/spectrasynq/K1-Lightwave_Digital-Twin/04_SAM3D_Environments/assets/masks/battlestation_batman/keyboard.png",
      "location": [
        0.0,
        0.0,
        0.0
      ],
      "rotation_euler": [
        0.0,
        0.0,
        0.0
      ],
      "scale": [
        1.0,
        1.0,
        1.0
      ]
    }
  ],
  "notes": "Generated by sam3d_reconstruct.py. Transforms are placeholders."
}